{
  "schemaVersion": 1,
  "contract": "kelly-asset-catalog",
  "state": "degraded",
  "catalogVersion": "2026-07-22-v4",
  "generatedAt": "2026-07-22T00:09:26.834573+00:00",
  "assetCount": 50,
  "providerPolicy": {
    "providers": [
      "krx",
      "yahoo_finance",
      "finance_data_reader",
      "stooq",
      "fred",
      "finviz"
    ],
    "normalizedOnly": true,
    "rawRedistribution": false,
    "rightsRequired": false
  },
  "assets": [
    {
      "id": "kr-005930",
      "symbol": "005930.KS",
      "name": "Samsung Electronics",
      "nameKo": "삼성전자",
      "assetType": "equity",
      "exchange": "KRX",
      "currency": "KRW",
      "timezone": "Asia/Seoul",
      "status": "unavailable",
      "provider": {
        "provider": "krx",
        "symbol": "005930",
        "exchange": "KRX"
      },
      "searchTerms": [
        "삼성전자",
        "samsung",
        "005930.KS"
      ],
      "dataPath": "assets/kr-005930.json",
      "returnBasis": "price_return",
      "availableFrom": null,
      "availableTo": null
    },
    {
      "id": "kr-000660",
      "symbol": "000660.KS",
      "name": "SK hynix",
      "nameKo": "SK하이닉스",
      "assetType": "equity",
      "exchange": "KRX",
      "currency": "KRW",
      "timezone": "Asia/Seoul",
      "status": "unavailable",
      "provider": {
        "provider": "krx",
        "symbol": "000660",
        "exchange": "KRX"
      },
      "searchTerms": [
        "SK하이닉스",
        "sk hynix",
        "000660.KS"
      ],
      "dataPath": "assets/kr-000660.json",
      "returnBasis": "price_return",
      "availableFrom": null,
      "availableTo": null
    },
    {
      "id": "index-gspc",
      "symbol": "^GSPC",
      "name": "S&P 500 Index",
      "nameKo": "S&P 500 지수",
      "assetType": "index",
      "exchange": "INDEX",
      "currency": "USD",
      "timezone": "America/New_York",
      "status": "published",
      "provider": {
        "provider": "yahoo_finance",
        "symbol": "^GSPC",
        "exchange": "INDEX"
      },
      "leveragedProducts": {
        "long2x": "etf-sso",
        "inverse2x": "etf-sds"
      },
      "searchTerms": [
        "S&P 500",
        "^GSPC",
        "SPX"
      ],
      "dataPath": "assets/index-gspc.json",
      "returnBasis": "price_return",
      "availableFrom": "2021-07-22",
      "availableTo": "2026-07-21"
    },
    {
      "id": "index-ndx",
      "symbol": "^NDX",
      "name": "NASDAQ-100 Index",
      "nameKo": "나스닥 100 지수",
      "assetType": "index",
      "exchange": "INDEX",
      "currency": "USD",
      "timezone": "America/New_York",
      "status": "published",
      "provider": {
        "provider": "yahoo_finance",
        "symbol": "^NDX",
        "exchange": "INDEX"
      },
      "leveragedProducts": {
        "long2x": "etf-qld",
        "inverse2x": "etf-qid"
      },
      "searchTerms": [
        "나스닥 100",
        "^NDX",
        "NDX"
      ],
      "dataPath": "assets/index-ndx.json",
      "returnBasis": "price_return",
      "availableFrom": "2021-07-22",
      "availableTo": "2026-07-21"
    },
    {
      "id": "index-sox",
      "symbol": "^SOX",
      "name": "PHLX Semiconductor Sector Index",
      "nameKo": "필라델피아 반도체지수",
      "assetType": "index",
      "exchange": "INDEX",
      "currency": "USD",
      "timezone": "America/New_York",
      "status": "published",
      "provider": {
        "provider": "yahoo_finance",
        "symbol": "^SOX",
        "exchange": "INDEX"
      },
      "searchTerms": [
        "필라델피아 반도체지수",
        "^SOX",
        "SOX"
      ],
      "dataPath": "assets/index-sox.json",
      "returnBasis": "price_return",
      "availableFrom": "2021-07-22",
      "availableTo": "2026-07-21"
    },
    {
      "id": "stock-aapl",
      "symbol": "AAPL",
      "name": "Apple",
      "nameKo": "애플",
      "assetType": "equity",
      "exchange": "NASDAQ",
      "currency": "USD",
      "timezone": "America/New_York",
      "status": "published",
      "provider": {
        "provider": "yahoo_finance",
        "symbol": "AAPL",
        "exchange": "NASDAQ"
      },
      "searchTerms": [
        "애플",
        "apple",
        "AAPL"
      ],
      "dataPath": "assets/stock-aapl.json",
      "returnBasis": "total_return_approximation",
      "availableFrom": "2021-07-22",
      "availableTo": "2026-07-21"
    },
    {
      "id": "stock-msft",
      "symbol": "MSFT",
      "name": "Microsoft",
      "nameKo": "마이크로소프트",
      "assetType": "equity",
      "exchange": "NASDAQ",
      "currency": "USD",
      "timezone": "America/New_York",
      "status": "published",
      "provider": {
        "provider": "yahoo_finance",
        "symbol": "MSFT",
        "exchange": "NASDAQ"
      },
      "searchTerms": [
        "마이크로소프트",
        "microsoft",
        "MSFT"
      ],
      "dataPath": "assets/stock-msft.json",
      "returnBasis": "total_return_approximation",
      "availableFrom": "2021-07-22",
      "availableTo": "2026-07-21"
    },
    {
      "id": "stock-nvda",
      "symbol": "NVDA",
      "name": "NVIDIA",
      "nameKo": "엔비디아",
      "assetType": "equity",
      "exchange": "NASDAQ",
      "currency": "USD",
      "timezone": "America/New_York",
      "status": "published",
      "provider": {
        "provider": "yahoo_finance",
        "symbol": "NVDA",
        "exchange": "NASDAQ"
      },
      "searchTerms": [
        "엔비디아",
        "nvidia",
        "NVDA"
      ],
      "dataPath": "assets/stock-nvda.json",
      "returnBasis": "total_return_approximation",
      "availableFrom": "2021-07-22",
      "availableTo": "2026-07-21"
    },
    {
      "id": "stock-amzn",
      "symbol": "AMZN",
      "name": "Amazon",
      "nameKo": "아마존",
      "assetType": "equity",
      "exchange": "NASDAQ",
      "currency": "USD",
      "timezone": "America/New_York",
      "status": "published",
      "provider": {
        "provider": "yahoo_finance",
        "symbol": "AMZN",
        "exchange": "NASDAQ"
      },
      "searchTerms": [
        "아마존",
        "amazon",
        "AMZN"
      ],
      "dataPath": "assets/stock-amzn.json",
      "returnBasis": "total_return_approximation",
      "availableFrom": "2021-07-22",
      "availableTo": "2026-07-21"
    },
    {
      "id": "stock-googl",
      "symbol": "GOOGL",
      "name": "Alphabet Class A",
      "nameKo": "알파벳 A",
      "assetType": "equity",
      "exchange": "NASDAQ",
      "currency": "USD",
      "timezone": "America/New_York",
      "status": "published",
      "provider": {
        "provider": "yahoo_finance",
        "symbol": "GOOGL",
        "exchange": "NASDAQ"
      },
      "searchTerms": [
        "알파벳",
        "google",
        "GOOGL"
      ],
      "dataPath": "assets/stock-googl.json",
      "returnBasis": "total_return_approximation",
      "availableFrom": "2021-07-22",
      "availableTo": "2026-07-21"
    },
    {
      "id": "stock-meta",
      "symbol": "META",
      "name": "Meta Platforms",
      "nameKo": "메타 플랫폼스",
      "assetType": "equity",
      "exchange": "NASDAQ",
      "currency": "USD",
      "timezone": "America/New_York",
      "status": "published",
      "provider": {
        "provider": "yahoo_finance",
        "symbol": "META",
        "exchange": "NASDAQ"
      },
      "searchTerms": [
        "메타",
        "meta",
        "META"
      ],
      "dataPath": "assets/stock-meta.json",
      "returnBasis": "total_return_approximation",
      "availableFrom": "2021-07-22",
      "availableTo": "2026-07-21"
    },
    {
      "id": "stock-tsla",
      "symbol": "TSLA",
      "name": "Tesla",
      "nameKo": "테슬라",
      "assetType": "equity",
      "exchange": "NASDAQ",
      "currency": "USD",
      "timezone": "America/New_York",
      "status": "published",
      "provider": {
        "provider": "yahoo_finance",
        "symbol": "TSLA",
        "exchange": "NASDAQ"
      },
      "searchTerms": [
        "테슬라",
        "tesla",
        "TSLA"
      ],
      "dataPath": "assets/stock-tsla.json",
      "returnBasis": "total_return_approximation",
      "availableFrom": "2021-07-22",
      "availableTo": "2026-07-21"
    },
    {
      "id": "stock-orcl",
      "symbol": "ORCL",
      "name": "Oracle",
      "nameKo": "오라클",
      "assetType": "equity",
      "exchange": "NYSE",
      "currency": "USD",
      "timezone": "America/New_York",
      "status": "published",
      "provider": {
        "provider": "yahoo_finance",
        "symbol": "ORCL",
        "exchange": "NYSE"
      },
      "searchTerms": [
        "오라클",
        "oracle",
        "ORCL"
      ],
      "dataPath": "assets/stock-orcl.json",
      "returnBasis": "total_return_approximation",
      "availableFrom": "2021-07-22",
      "availableTo": "2026-07-21"
    },
    {
      "id": "stock-crm",
      "symbol": "CRM",
      "name": "Salesforce",
      "nameKo": "세일즈포스",
      "assetType": "equity",
      "exchange": "NYSE",
      "currency": "USD",
      "timezone": "America/New_York",
      "status": "published",
      "provider": {
        "provider": "yahoo_finance",
        "symbol": "CRM",
        "exchange": "NYSE"
      },
      "searchTerms": [
        "세일즈포스",
        "salesforce",
        "CRM"
      ],
      "dataPath": "assets/stock-crm.json",
      "returnBasis": "total_return_approximation",
      "availableFrom": "2021-07-22",
      "availableTo": "2026-07-21"
    },
    {
      "id": "stock-nflx",
      "symbol": "NFLX",
      "name": "Netflix",
      "nameKo": "넷플릭스",
      "assetType": "equity",
      "exchange": "NASDAQ",
      "currency": "USD",
      "timezone": "America/New_York",
      "status": "published",
      "provider": {
        "provider": "yahoo_finance",
        "symbol": "NFLX",
        "exchange": "NASDAQ"
      },
      "searchTerms": [
        "넷플릭스",
        "netflix",
        "NFLX"
      ],
      "dataPath": "assets/stock-nflx.json",
      "returnBasis": "total_return_approximation",